{
  "schema": "ylx.device-session.v2",
  "manifest_id": "01989f6c-2c01-7b2c-9d3e-4f5061728394",
  "sealed": true,
  "sealed_at": "2026-08-08T10:31:33+08:00",
  "session_id": "01989f6c-2c00-7a1b-8c2d-3e4f50617283",
  "volume_id": "6ba7b812-9dad-41d1-80b4-00c04fd430c8",
  "capture_mode": "production",
  "display_name": "2026-08-08_10-31-00_YLX-30D5872D",
  "device": {
    "device_id": "550e8400-e29b-41d4-a716-446655440000",
    "device_label": "YLX-30D5872D",
    "hardware_fingerprint": "sha256:aaaaaaaaaaaaaaaaaaaaaaaaaaaaaaaaaaaaaaaaaaaaaaaaaaaaaaaaaaaaaaaa",
    "platform": "raspberry-pi-5",
    "software_version": "0.11.0-dev.1",
    "commit": "b7d044d4bbc5ef0e335d2789c54f7d837d1a3e01"
  },
  "time": {
    "started_at": "2026-08-08T10:31:00+08:00",
    "ended_at": "2026-08-08T10:31:30+08:00",
    "timezone": "Asia/Shanghai",
    "duration_seconds": 30
  },
  "take": {
    "take_id": "01989f6c-f000-7c3d-ae4f-5061728394a5",
    "sequence": 1,
    "continuation_of": null
  },
  "camera": {
    "width": 3840,
    "height": 1080,
    "eye_width": 1920,
    "sensor_fps": 60,
    "frame_decimation": 2,
    "nominal_fps": 30,
    "effective_fps": 30,
    "coordinate_frame": "opencv_optical"
  },
  "video": {
    "layout": "split-eyes",
    "codec": "h264",
    "container": "mp4",
    "segments": [
      {
        "index": 0,
        "start_frame": 0,
        "end_frame": 900,
        "start_time_seconds": 0,
        "end_time_seconds": 30,
        "artifacts": {
          "left": {
            "artifact_id": "aaaaaaaaaaaaaaaaaaaaaaaaaaaaaaaaaaaaaaaaaaaaaaaaaaaaaaaaaaaaaaaa",
            "role": "video.left",
            "path": "video/left_00000.mp4",
            "media_type": "video/mp4",
            "bytes": 30123456,
            "sha256": "aaaaaaaaaaaaaaaaaaaaaaaaaaaaaaaaaaaaaaaaaaaaaaaaaaaaaaaaaaaaaaaa"
          },
          "right": {
            "artifact_id": "bbbbbbbbbbbbbbbbbbbbbbbbbbbbbbbbbbbbbbbbbbbbbbbbbbbbbbbbbbbbbbbb",
            "role": "video.right",
            "path": "video/right_00000.mp4",
            "media_type": "video/mp4",
            "bytes": 30234567,
            "sha256": "bbbbbbbbbbbbbbbbbbbbbbbbbbbbbbbbbbbbbbbbbbbbbbbbbbbbbbbbbbbbbbbb"
          }
        }
      }
    ]
  },
  "imu": {
    "artifact": {
      "artifact_id": "cccccccccccccccccccccccccccccccccccccccccccccccccccccccccccccccc",
      "role": "imu.samples",
      "path": "imu/imu.jsonl",
      "media_type": "application/x-ndjson",
      "bytes": 166400,
      "sha256": "cccccccccccccccccccccccccccccccccccccccccccccccccccccccccccccccc"
    },
    "sample_count": 6000,
    "units": "raw_int16",
    "coordinate_frame": "raw_device_axes"
  },
  "frames": {
    "artifact": {
      "artifact_id": "dddddddddddddddddddddddddddddddddddddddddddddddddddddddddddddddd",
      "role": "frames.index",
      "path": "imu/frames.jsonl",
      "media_type": "application/x-ndjson",
      "bytes": 120240,
      "sha256": "dddddddddddddddddddddddddddddddddddddddddddddddddddddddddddddddd"
    },
    "count": 900
  },
  "audio": {
    "state": "not_recorded",
    "requested_mode": "disabled",
    "resolved_mode": "disabled",
    "reason": "user_disabled"
  },
  "logs": [
    {
      "artifact_id": "eeeeeeeeeeeeeeeeeeeeeeeeeeeeeeeeeeeeeeeeeeeeeeeeeeeeeeeeeeeeeeee",
      "role": "log.capture",
      "path": "logs/capture.log",
      "media_type": "text/plain",
      "bytes": 12034,
      "sha256": "eeeeeeeeeeeeeeeeeeeeeeeeeeeeeeeeeeeeeeeeeeeeeeeeeeeeeeeeeeeeeeee"
    }
  ],
  "integrity": {
    "verified_at": "2026-08-08T10:31:32.800+08:00",
    "dropped_frames": 0,
    "drop_events": [],
    "quality_policy": {
      "policy_id": "rdk-x5-lossless-v1",
      "max_contiguous_dropped_frames": 0,
      "max_total_dropped_frames": 0,
      "max_drop_fraction": 0,
      "window_seconds": 1,
      "max_dropped_frames_per_window": 0
    },
    "media_write_throughput_bytes_per_second": 10925000,
    "fatal_errors": []
  }
}
